section,question_number,answer_number,speaker_name,role,company,content,year,quarter,is_pleasantry
qa,12,1,Jamie Dimon,Chairman & Chief Executive Officer,JPMorganChase,"Yeah, sure. So, I think what you're referring to is a slide where Marianne talked about kind of the potential for 6% consumer deposit growth next year. And that's a nice number; and as you've written, that would produce some nice revenue consequences, all else being equal. The way I think about that number is to kind of build it up step-by-step. So, you start with, in general, the consumer deposit base in the system has grown probably slightly above nominal GDP. A thing that's been true for us recently is that as a result of our market position and our pricing choices, we've probably lost a little bit of share during the rate hiking cycle sort of in isolation from yield seeking flows. With the yield seeking flows having abated a little bit, that relative headwind is kind of behind us or increasingly behind us, and you've got some core growth reasserting itself. You saw us call out the growth in net new accounts in consumer checking this quarter, and that's one of the key drivers. And then, as you know well, when you look at the franchise, we kind of have: number one, ongoing expansion; number two, seasoning of the old expansion; and number three, deepening in the core markets. So when you put all that together and you look at sort of the history of the growth, macro environment, et cetera, that's how you get to that type of 6% number. And obviously, things could change quite dramatically to produce a different number, among other things. You'll recall that Marianne's slide also talked about a stress scenario with lower rates which, perhaps somewhat non-intuitively, would produce actually higher growth as a result of even less yield seeking flow and a higher consumer savings rate. But the flip side of that is also true which is, an unexpectedly high rate environment would probably lead to lower balance growth, all else equal, in Consumer. So, we like to say, those are all else being equal type numbers, but all else is never equal.",2025,Q2,False
qa,12,1,John McDonald,analyst,Truist Securities Inc.,Got it. Great. Thank you.,2025,Q2,False
qa,12,2,Jeremy Barnum,Chief Financial Officer,JPMorganChase,"Thanks a lot, John. Operator: Thank you. Next, we will go to the line of Mike Mayo with Wells Fargo. Your line is open.",2025,Q2,False
qa,13,,Mike Mayo,analyst,Well Fargo Securities LLC,"Hi. Hey, Jeremy, can you talk about why commercial loan growth was much stronger in the second quarter and any strength by geography? And Jamie, can you address what regulators could do to potentially have banks lend more in the future, consistent with what the Treasury Secretary said is his goal? Thanks.",2025,Q2,False
qa,13,1,Jeremy Barnum,Chief Financial Officer,JPMorganChase,"Yeah. Thanks, Mike. So on loan growth, as you know, it's useful to sort of break this down between what I would think of as like relationship lending that kind of drives the whole franchise and that we sometimes look at maybe as an indicator of the health of the corporate sector in some sense, and people like to look at it as a read across for smaller banks, et cetera. That part of the franchise remains fine, but sort of muted as customers have access to capital markets and revolver utilization is sort of flattish in general. But as I noted I think previously, and as you see coming through the IB fee performance, there was just quite a bit of deal activity in the second half of the quarter, a lot of which is well known and public, and some of that is on our balance sheet and we're very happy to have it there.",2025,Q2,False
qa,13,2,Jamie Dimon,Chairman & Chief Executive Officer,JPMorganChase,"To answer your other question, Mike. So, some of the – I'm going to give you some things that you can actually do. So, I think you should do them and reduce risk in the system. I'm only going to talk about how they increase lending for a second. And so, G-SIFI inhibits, if you look at it, both a little bit of lending and a little bit of market making. LCR inhibits both because it's a very rigid way of looking at a bank’s balance sheet. It doesn't really give you credit for potential access to window and things like that. CCAR in some cases inhibit – people – we talk about ‘CCAR-ness,’ but there's a lot of ‘CCAR-ness’ from small business loans and stuff like that where people kind of hold that back a little bit because it creates too much volatility. And CCAR capital, the FSRT, the fundamental book. When you look at all these things, I think you can create more lending, more liquidity, more flexibility and reduce the risk in the system. And also just CET, just capital usage, et cetera. And the reducing the risk in the system, I think you also make it friendlier for community banks, which we do want to do. And so, if you look at like total loan to deposits, they used to be 100%, they’re now 70%. That's a huge difference. That took place over 10 or 15 years. And can you get that back to 85% and have the banking system be just safe and sound? Absolutely.",2025,Q2,False
qa,14,,Mike Mayo,analyst,Well Fargo Securities LLC,You didn't mention the cost to make a loan. Is there a potential for streamlining there?,2025,Q2,False
qa,14,1,Jamie Dimon,Chairman & Chief Executive Officer,JPMorganChase,"Yes, and I would put securitizations in that category. We need a more active securitization market and all these things could reduce the actual cost of making a loan. I pointed out in the past that mortgages probably cost 30 or 40 or 50 basis points more because of excessive securitization, origination and servicing requirements. Those could be changed and would dramatically help mortgages, particularly for low- income individuals. And we just have failed to do it for 10 years, and it wouldn't create any additional risk. And we can show you data that shows that.",2025,Q2,False
qa,15,,Mike Mayo,analyst,Well Fargo Securities LLC,"And last one, when you say inorganic growth, would you buy a private credit firm? Is that something you'd at least consider?",2025,Q2,False
qa,15,1,Jamie Dimon,Chairman & Chief Executive Officer,JPMorganChase,"I would say, it's not high on my list because we can do it ourselves and then you know buying people and comp plans. And I also think you may have seen peak private credit a little bit. I don't know that, but we already do it. So if it was the right people, the right price, the right – sure, we should look at it. I think, Mike, you should always be open minded when people come to you with something you hadn't thought about before. And you just get smarter by looking at these things.",2025,Q2,False
qa,16,,Mike Mayo,analyst,Well Fargo Securities LLC,"Actually I can’t leave on that comment. Peak private credit, I can't leave on those three words. What do you mean by peak private credit?",2025,Q2,False
qa,16,1,Jamie Dimon,Chairman & Chief Executive Officer,JPMorganChase,"I've mentioned that credit spreads are very low. It's grown dramatically over time. And you have to pay up a lot for it. I'm not saying, it's not going to grow some more, but I would have a slight reluctance depending on who it was. But your bankers might come to us with something tomorrow that we just hadn't thought about that is a complete natural fit for us; natural fit being product and people and culture.",2025,Q2,False
qa,17,,Mike Mayo,analyst,Well Fargo Securities LLC,"Sorry, Jeremy?",2025,Q2,False
qa,17,1,Jeremy Barnum,Chief Financial Officer,JPMorganChase,"No, I was literally going to say what Jamie just said. So, we're good.",2025,Q2,False
qa,17,1,Mike Mayo,analyst,Well Fargo Securities LLC,All right. Thank you. Operator: Thank you. Next we will go to the line of Erika Najarian with UBS. You may proceed.,2025,Q2,False
qa,18,,Erika Najarian,analyst,UBS Securities LLC,"Hey, good morning. Jamie and Jeremy, you've talked about simplifying the regulatory construct. And it seems like based on the progress so far, we'll mostly get there, particularly with Basel III Endgame and G-SIB, which impacts you so much. And to that end, if we do get a more simplified regulatory construct that addresses both the capital and liquidity constraints, does that move up JPMorgan's natural ROTCE? You talked, 17% through-the-cycle a lot. Obviously, perhaps we would optimize the denominator. Why wouldn't that be additive to your natural ROTCE? Or does this get passed back on to your clients in terms of pricing?",2025,Q2,False
qa,18,1,Jamie Dimon,Chairman & Chief Executive Officer,JPMorganChase,"In a competitive world, it is irrational to think that – and when it applies to all the competitors – that everybody's just going to make a lot more money, you keep it as opposed to compete in the marketplace. Hopefully, we'll still have a good competitive position relative to everybody else. But no, I don't think you should automatically say, it's going to increase your returns. Remember, Jeff Bezos says, “Your margin is my opportunity.” That would be a huge opportunity for fintech, private credit, alternative players, et cetera. So, you have to be a little careful to think that would happen. I think it's a good thing for the system though.",2025,Q2,False
qa,18,2,Jeremy Barnum,Chief Financial Officer,JPMorganChase,"Yeah, exactly. And as we always say, Erika, right, like the market is very competitive and the returns are high. And you know this, but I would just refer you to the slide that I delivered at Investor Day about how, in some cases, it makes, all else equal, compared to buying back shares at these prices, doing healthy, well underwritten, compelling franchise business with a 14% return, we're definitely supposed to do that actually. And if we do a lot of that, it will dilute down the weighted-average ROTCE of the company in ways that are nonetheless clearly accretive to shareholders. So,...",2025,Q2,False
qa,18,3,Jamie Dimon,Chairman & Chief Executive Officer,JPMorganChase,"And Jeremy showed you a little thing about business units that earn high returns to low returns. And not that you shouldn’t do low return ones because they fit hand in glove with other stuff. If you didn't do it, you might lose the other. But there are some businesses out there with very high returns that we just grow. We deploy capital by adding bankers or branches or products, not directly by deploying capital. So, just think of branches. That does it or private banking or things like that.",2025,Q2,False
qa,19,,Erika Najarian,analyst,UBS Securities LLC,"Yeah, for sure. And I think that's a big discussion point with investors in terms of talking about actually the EPS gains rather than just ROTCE improvement. And the second question I had is, you mentioned and clearly we saw it in the numbers, a late in the quarter pickup in activity levels. And I'm wondering as we think about sentiment and what this means for the second half, is it – did activity levels pick up because it felt like we were taking extreme outcomes from tariff policy off the table? Is it the tax bill certainty? I guess, I'm just wondering, has some of the issues that prevented activity levels or really stunted it in April and early May, have those fully been taken out of your clients' thinking as we think about the second half of the year and activity levels continuing from here?",2025,Q2,False
qa,19,1,Jamie Dimon,Chairman & Chief Executive Officer,JPMorganChase,"Jeremy, you might want to say – I'll just answer your question by saying, honestly, we don't know. And you've seen how rapidly whole pipelines can grow and shrink. And so, that lesson we've learned over and over, and it may stay wide open for a year and a half. Something may happen geopolitically, then all of a sudden that pipeline slows a little bit. And so, I'm always a little cautious to guess what that's going to be. But if it continues this way, yeah, you're going have very active buckets.",2025,Q2,False
qa,19,2,Jeremy Barnum,Chief Financial Officer,JPMorganChase,"Yeah. And my version of that, Erika, would be to say that you talked about certain of the tail risks getting taken completely off the table, and that's clearly not true, right. All the tail risks are all still there, quite prominently, and in many cases, in the daily news flow. Maybe at the margin the tails are a little bit less fat right now. I think it's also true that in terms of our – what the things that we've said about our Investment Banking pipeline have been consistently quite cautious. And at a certain point, when you have the type of outperformance that you have this quarter, it starts to make your cautiousness",2025,Q2,False
qa,19,3,Jeremy Barnum,Chief Financial Officer,JPMorganChase,"seem less credible. So, we wanted to take a hard look at ourselves and say, what do we really think? And it's like, yeah, the sentiment is better. But as Jamie says like, that can change overnight and there are lot of risks out there.",2025,Q2,False
qa,19,4,Jamie Dimon,Chairman & Chief Executive Officer,JPMorganChase,"I do think that extending the tax bill for businesses to know what their taxes are going to be, is a positive going forward. And that does reduce the risk that the bill didn't get done. I also think, when it comes to tariffs, I think the initial liberation day – now there's more talk, there's more things getting done, a couple have been announced, a couple have been delayed. That reduces that risk a little bit. And hopefully, they'll get done. There's still risk out there, but I am hopeful some of these frameworks are completed soon, at least before August 1.",2025,Q2,False
qa,19,4,Erika Najarian,analyst,UBS Securities LLC,Thank you. Operator: Thank you. Next we will go to the line of Jim Mitchell with Seaport Global Securities. Your line is open.,2025,Q2,False
qa,20,,Jim Mitchell,analyst,Seaport Global Securities LLC,"Hey, good morning. Thanks for taking the questions. Maybe just on – Jeremy, if I look at your 10-Q and 10-K rate sensitivity disclosures, it looks like you guys have done a lot to reduce your asset sensitivity to the short end of the curve. So, can you talk about what you've been doing to change the positioning of the balance sheet, whether extending duration or hedges? And is there more you can do to desensitize the balance sheet before rate cuts begin to kick in as, I guess, the markets expect later this year? Thanks.",2025,Q2,False
qa,20,,Jeremy Barnum,Chief Financial Officer,JPMorganChase,Yeah.,2025,Q2,True
qa,20,1,Jamie Dimon,Chairman & Chief Executive Officer,JPMorganChase,"Now, before he goes on, what the market expects is almost what never happens.",2025,Q2,False
qa,20,1,Jim Mitchell,analyst,Seaport Global Securities LLC,Fair enough.,2025,Q2,False
qa,20,2,Jeremy Barnum,Chief Financial Officer,JPMorganChase,"All right. So, it's a good question, Jim. But yeah, as Jamie points out, just remember that to the extent that the market is efficient which maybe it's not, but you can't really hedge ahead of cuts that are already priced in, right. So, that’s worth saying out loud. But, I mean, you can decrease volatility, but it's just a question of now or later. But having said that, on the question of decreasing volatility, we did in fact add some duration this quarter, with the usual mix of instruments and strategies, but primarily in the front end of the yield curve which was designed to essentially balance out the tails a little bit, so that we were a little bit less exposed to a classic recessionary type scenario with much lower rates in exchange for accepting a little bit less good outcomes and like higher rate scenarios, at least narrowly through the lens of NII.",2025,Q2,False
qa,20,3,Jeremy Barnum,Chief Financial Officer,JPMorganChase,"As we've talked about a little bit over time, though, I like the way you framed it in terms of like having the capacity. And I think the way to think about it there is that, in general, it's almost impossible to get your asset – for a bank like us, it's almost impossible to get your asset sensitivity – your actual asset sensitivity down to zero, because you wind up constrained by other things. So, we're in the corridor and we're okay with where we are right now.",2025,Q2,False
qa,21,,Jim Mitchell,analyst,Seaport Global Securities LLC,"Okay. Thanks. And maybe just one more on the regulatory front. I think regulators look at reducing the SLR as a way to encourage banks or open up an avenue to expand your balance sheets into lower risk assets. Do you see that, is it really just a supply issue or how do you think about the demand-supply dynamic, and is there really opportunities for you to grow? I would imagine, I guess, with an SLR not being constrained, maybe it's better return in lower margin areas. Just your thoughts.",2025,Q2,False
qa,21,1,Jeremy Barnum,Chief Financial Officer,JPMorganChase,"Yeah, it's a good question. You may recall, I actually got a version of this question at Investor Day, so I'll almost repeat my answer here which is that, as we know, fixing SLR has been on the list for a long time. It behaved very much not the way it was designed in the moment of big QE when it became binding and it had bad impacts on the system. It's the opposite of what we want for these backstop measures. And so, we don't want regulators to need to make unusual corrections amid crisis. It's just not the right way to run the railroad. I think everyone has agreed on that for a long time. And in that context, it's been sort of disappointing that something as obvious as this has taken as long as this to get fixed, but it's a good sign that it's now out there. And we’d certainly support the proposal, there are some nuances that – or a comment had been requested, but at a high level, it's a good proposal, it's the right thing to do. And it's the right thing to do from the perspective of the resilience of the system for the next time that we've got that type of expansion in the size of the system that could make it binding in the wrong way for the wrong reasons. But yeah, as you note and as we've said, we're not really bound by it. I think other actors in the market may be a little bit more bound by it. There are also some nuances about impact on portfolio activity which I would expect to be very small, versus impact on low risk intermediation in the market making businesses, which may be where you would hope to see the effect. So, it's a good thing. Hopefully, it will help. Obviously, it's pretty fully priced in at this point, so I don't think you're going to see a big pop one way or the other as a function of it's eventually being finalized, because I think everyone's assuming it will go in roughly in its current form.",2025,Q2,False
qa,21,2,Jamie Dimon,Chairman & Chief Executive Officer,JPMorganChase,"And I’m like a broken record. It's not SLR, it's LCR, it's G-SIFI, it's CCAR, it's Basel IV, the gold plating. You really got to step back and look at all of them, and how you use the discount window, et cetera. And even how you measure liquidity which is different in one measure than it is in resolution recovery. They should look at all of that if they really want to fix the system.",2025,Q2,False
qa,21,2,Jim Mitchell,analyst,Seaport Global Securities LLC,All right. Thanks for the color.,2025,Q2,False
qa,21,3,Jeremy Barnum,Chief Financial Officer,JPMorganChase,Thanks. Operator: Thank you. Next we will go to the line of Ken Usdin from Autonomous. You may proceed.,2025,Q2,False
qa,22,,Ken Usdin,analyst,Autonomous Research,"Thanks. Good morning. First question is, I just wanted to ask you about the recent Sapphire price changes and just what you're seeing in terms of initial response and just how that fits in strategically with the competitive landscape on card and your growth opportunity.",2025,Q2,False
qa,22,,Jeremy Barnum,Chief Financial Officer,JPMorganChase,"Yeah, sure. So, let me dispense with the question of how it's going for...",2025,Q2,True
qa,22,1,Jamie Dimon,Chairman & Chief Executive Officer,JPMorganChase,So far.,2025,Q2,False
qa,22,2,Jeremy Barnum,Chief Financial Officer,JPMorganChase,"Going fine. We're happy. In terms of the strategic aspects of this and the competitive landscape, I think the way we think about this is, as a normal course refresh of one of our important products and the way that all of our products get refreshed periodically. Obviously, this is a relatively high profile product. Many of us have the card, we see the ads everywhere. So, it sort of punches above its weight in that respect in terms of visibility. In terms of the competitive landscape, I think a thing that we feel really great about is the dramatic increase in the customer value proposition associated with the card. And in particular, one of the things that we look at is the ratio of the customer value to the annual fee which is clearly market leading at this point. So...",2025,Q2,False
qa,22,3,Jamie Dimon,Chairman & Chief Executive Officer,JPMorganChase,"I got a lot of comments that people – from friends of my kids and stuff like that, that man, you have got to raise the card but you have to keep it for the LaGuardia lounge; and that's the value added. Jeremy Barnum Chief Financial Officer, JPMorganChase And then some. Theres a lot of value added.",2025,Q2,False
qa,22,4,"Chief Financial Officer, JPMorganChase",And then some. Theres a lot of value added.,JPMorganChase,"Yeah. And obviously, I mean, we're not going to talk too much about competitors. But as you know, the card space is very competitive and very dynamic. So, we exist in a competitive landscape, and this is our best foot forward on this product at this moment in time.",2025,Q2,False
qa,23,,Ken Usdin,analyst,Autonomous Research,"Got it. It is quite a nice lounge. On the trading side, just wondering how much – the strong results this quarter, the quarter changed a lot from April to June. And I'm just wondering, how much you think that was environmental? Has it calmed down at all? And also, how much is just your ability to kind of use the balance sheet to boost results also, could that make it more sustainable regardless of what the environment is doing? Thanks a lot.",2025,Q2,False
qa,23,1,Jeremy Barnum,Chief Financial Officer,JPMorganChase,"Good question. Honestly, I think it's kind of all of the above, basically. No question that the tone shifted. Obviously, it shifted in Investment Banking. I think I personally was a little bit surprised by the resilience of the Markets revenues in the second half of the quarter, because I was sort of expecting a little bit of an offset between the two.",2025,Q2,False
qa,23,2,Jamie Dimon,Chairman & Chief Executive Officer,JPMorganChase,I was not surprised. Jeremy Barnum,2025,Q2,False
qa,23,3,"Chief Financial Officer, JPMorganChase",Okay,there you have it.,"But it's not like I thought it would do badly, but it sort of did quite well in the volatility in the first half of the quarter, and then it got quiet, but despite that we still did nicely. And I think the point actually sort of to your question is that, yes, we are seeing opportunities to deploy capital and other resources; and yeah, maybe at the margin that does contribute a little bit to durability. We've talked over time about the Markets revenues and the dramatic increase. Obviously, 2019 is a long time ago at this point, and we should expect those revenues to grow with GDP anyway, but we worried a lot in certain moments about the revenues dropping back to some old run rate, and then we kind of stopped worrying about that. And now, of course, they've gone up to new highs, so maybe we should be worried again. But a thing I like to remind myself of, to your point is that, while the revenues have gone up a lot, the resource usage has also gone up a lot. So, we are deploying a lot of capital and other resources in this business, and we're earning good returns on it, but the revenue growth is not coming for free. So, it's us running the place, basically.",2025,Q2,False
qa,23,3,Ken Usdin,analyst,Autonomous Research,"Okay. Thank you, Jeremy.",2025,Q2,True
qa,23,4,Jeremy Barnum,Chief Financial Officer,JPMorganChase,Thanks a lot. Operator: Thank you. Next we will go to the line of Matt O'Connor with Deutsche Bank. Your line is open.,2025,Q2,False
qa,23,4,Matt O’Connor,analyst,"Deutsche Bank Securities, Inc",Good morning. Some regional banks...,2025,Q2,True
qa,23,5,Jeremy Barnum,Chief Financial Officer,JPMorganChase,"Matt, you've got some major static on the line. I don't know if we're going to be able to hear you. Just give it a shot. Give it a shot.",2025,Q2,False
qa,24,,Matt O’Connor,analyst,"Deutsche Bank Securities, Inc",Can you hear me better now?,2025,Q2,False
qa,24,1,Jeremy Barnum,Chief Financial Officer,JPMorganChase,"Not really, but let's try. Let's try.",2025,Q2,False
qa,25,,Matt O’Connor,analyst,"Deutsche Bank Securities, Inc","I just wanted to ask about any pressure from commercial and corporate customers to try to offset the tariff impact from regional banks that pointed to deposit pricing pressure on the commercial side, and if you're seeing any signs of that or more broadly speaking? Thank you.",2025,Q2,False
qa,25,1,Jeremy Barnum,Chief Financial Officer,JPMorganChase,"I think if I heard the question correctly, you were asking...",2025,Q2,False
qa,25,2,Jamie Dimon,Chairman & Chief Executive Officer,JPMorganChase,Are you offsetting tariff pressure with pressure on loans or deposits. The answer is no.,2025,Q2,False
qa,25,3,Jeremy Barnum,Chief Financial Officer,JPMorganChase,"The answer is no, yeah.",2025,Q2,False
qa,25,3,Matt O’Connor,analyst,"Deutsche Bank Securities, Inc",Okay. Thank you.,2025,Q2,True
qa,25,4,Jeremy Barnum,Chief Financial Officer,JPMorganChase,"I wish we could say more about it, but we think the answer is no.",2025,Q2,False
