section,question_number,answer_number,speaker_name,role,company,content,year,quarter,is_pleasantry
qa,25,5,Jamie Dimon,Chairman & Chief Executive Officer,JPMorganChase,"No, I mean there's always pressure in some of those...",2025,Q2,False
qa,25,6,Jeremy Barnum,Chief Financial Officer,JPMorganChase,"It's a competitive market, right? There is ongoing – deposits are very, very competitive, and there are always pricing conversations as there should be. It's hard to know in any given moment what's driving it, but I haven't heard anything to support a tariff linked narrative. Operator: Thank you. Next we will go to the line of Glenn Schorr with Evercore. Your line is open.",2025,Q2,False
qa,26,,Glenn Schorr,analyst,Evercore Group LLC,"Hi, thanks. Just two quick follow ups. On the conversation about the noticeably upbeat robust pipelines, I know we've been here before and markets can giveth and taketh away, but there is a time value in there, meaning corporates and more importantly sponsors need to get stuff done. There is a ton of dry powder. So I'm curious if there's a higher level of confidence, meaning if the market doesn't take from us, is it really happening this time? We've been kind of waiting for these pipelines to come through in fuller force for a couple of years now. Does it feel more doable as long as the market doesn't take the rug out from under us?",2025,Q2,False
qa,26,1,Jamie Dimon,Chairman & Chief Executive Officer,JPMorganChase,"I think it separates sponsor-owned companies from IPOs. There are companies going public, they're in the pipeline, they want to go public, et cetera. Sponsors are still, at least from what I can tell anecdotally, still reluctant to use the public markets. There obviously maybe more of it, but it hasn't been a mountain of stuff coming out.",2025,Q2,False
qa,26,2,Jeremy Barnum,Chief Financial Officer,JPMorganChase,"Yeah. I think that's right in the IPO space at least for now. But I have heard some things to support some elements of your narrative Glenn, the effect of that – now, there is pressure to kind of recycle capital and get things done. And yeah, sure, after the initial shock of tariff policy changes, everyone kind of went on hold. But as we've noted in our comments a few times today, at a certain moment you just have to move on with life, and it does feel like some of that is happening just because you can't delay forever.",2025,Q2,False
qa,27,,Glenn Schorr,analyst,Evercore Group LLC,"I hear you. The follow-up on the capital conversation, obviously impressive to see big returns on even higher capital bases. But there's more to come, and I think trend is your friend on dereg. So the question is, you keep making a lot of money, your capital base keeps rising. You've talked about arresting the growth of CET1 in the past, but I guess my blunt question is, is there any valuation limitation towards that arresting of CET1?",2025,Q2,False
qa,27,1,Jeremy Barnum,Chief Financial Officer,JPMorganChase,"Okay. Wait, I want to say a couple of things, and then I want to clarify an aspect of your question, Glenn. So first, on arresting the growth, what I actually said, not to nitpick on you, but I said arresting the growth of excess capital which I agree is reasonable to interpret as keeping a roughly constant CET1. As it happened this quarter, you see the CET1 actually dropping about 40 basis points, and that was in no small part a function of significant late quarter growth in RWA usage which we were frankly like very happy to see, in fact. So, that's all to the good in some sense. Now the other part of your question, can you just repeat it? I want to make sure I understand it.",2025,Q2,False
qa,28,,Glenn Schorr,analyst,Evercore Group LLC,"I'm just curious if there's a valuation limitation to the thinking, meaning as valuation goes up, do you keep buying back stock?",2025,Q2,False
qa,28,1,Jeremy Barnum,Chief Financial Officer,JPMorganChase,"Meaning, would we go back to a moment of reducing buybacks and starting to build again if the stock gets even more expensive? I mean, I think that's the question for the boss, but I don't know, I guess, we always reserve the right to do whatever we want on buybacks basically.",2025,Q2,False
qa,28,2,Jamie Dimon,Chairman & Chief Executive Officer,JPMorganChase,"We reserve the right. We're not going to tell you. But obviously, as stock price – I mean, don't like buying back the stock at almost three times tangible book. No one's going to convince me that's a brilliant thing to do, but it is wise to use our balance sheet for customers, which we're doing, and we can possibly do more. And it is probably wise to not increase the excess capital anymore since we have plenty and it's going be going up. Look, I'm completely convinced if you take out of your mindset 12 months, we will use the capital wisely for shareholders.",2025,Q2,False
qa,28,2,Glenn Schorr,analyst,Evercore Group LLC,You always do. All right. Thank you.,2025,Q2,False
qa,28,2,Jeremy Barnum,Chief Financial Officer,JPMorganChase,"Thanks, Glenn.",2025,Q2,True
qa,28,3,Jamie Dimon,Chairman & Chief Executive Officer,JPMorganChase,"The best way is organic growth, which I wouldn't rule out that we can find more ways to grow clients basically. Operator: Thank you. Our next question comes from Gerard Cassidy with RBC Capital Markets. Your line is open.",2025,Q2,False
qa,29,,Gerard Cassidy,analyst,RBC Capital Markets LLC,"Hi, Jeremy. Hi, Jamie. I'd like to circle back to the return on tangible common equity topic that you guys have discussed. Obviously, you had a very strong number this quarter, 20% when you adjusted for the one-time effect. And you go back to your Investor Day and you pointed out 17% is what the targeted level is. And if you turn back the clock and go back to 2020, you had the same 17% goal for the ROTCE, but your CET1 ratio back then was – excuse me, guidance was 11.5% to 12%. So my question is, has the business for you folks changed so much that now it's just inherently a more profitable business? Or are there some one-time – not one-time items, but are there some tailwinds that are artificially – I hate to use that word, but are they inflating the ROTCE which is why you guys are very cautious about lifting that goal from 17%?",2025,Q2,False
qa,29,1,Jamie Dimon,Chairman & Chief Executive Officer,JPMorganChase,"Jeremy can answer this, but this will be an important point. The value to shareholders is that we can not just earn 17% ROTCE and that we can reinvest money at 17% ROTCE. That's the value. If you're just going to earn 17%, you’re a bond. You will trade three times tangible book, but that's it for the rest of your life. And so, the goal is to find opportunities to grow and expand your business, which we are doing. If you look at it, we are doing that with branches and bankers and internationally. And when you look at the midcap business we're doing in Europe, it's been great. Innovation Economy has been great. We're gaining shares in lot of places, Chase Wealth Management and the Private Bank, the International Private Bank, payment systems. We’re investing in all those things to grow our franchises and that's the best way to use your capital. And forget the timetable of that. That is the best way to use it.",2025,Q2,False
qa,29,2,Jeremy Barnum,Chief Financial Officer,JPMorganChase,"Yeah. And Gerard, I guess on your other question, it's an interesting question. I don't think the answer is really knowable, and I feel like it's kind of all of the above. Let me say what I mean. Like, on the one hand, I think if you look at the current market environment, it's hard to imagine a set of conditions that would be any better for us, right. Rates are at a good level for us, deal activity is high, capital markets are very strong, consumer credit is excellent, wholesale credit is excellent, wealth management, asset management, essentially every part of the company is firing. We're essentially firing on all cylinders, with some very minor exceptions of certain businesses that are extremely rate sensitive, like Home Lending, where they're still doing a great job in what is a very tough market. So when you see that, you're like, well, that's not normal. Normally, you would have some pockets doing a little better, some pockets doing a little worse; and that's part of what makes you think that some aspects of this are maybe not sustainable. On the other hand, it's also true that core elements of the strategy are working very well, and we've been investing for a long time very successfully and kind of leaning in even in moments where from the outside there wasn't that much appetite for us to be investing in all of the things that Jamie's talking about. Some of those investments in various ways are paying off. So...",2025,Q2,False
qa,29,3,Jamie Dimon,Chairman & Chief Executive Officer,JPMorganChase,"You have – all of our major bank competitors are back and growing and expanding. You have the fintech folks who are quite capable and quite smart who want to take big chunks of your business. Everything we do is kind of competitive around the world. So the notion that somehow we're not going deal with our competitors, which protects JPMorganChase, we don't get complacent, we don't get arrogant, we don't get bureaucratic. And we keep on finding that you got to have to fight for it every day. And so, we're quite cautious to just declare victory like somehow we're entitled to these returns forever. Also pointed out, if you could compound at 17%, actually I had Jeremy do his number one point, if you compounded 17% for 20 years, you probably would have a good chunk of the GDP of United States of America, for 40 years maybe.",2025,Q2,False
qa,29,4,Jeremy Barnum,Chief Financial Officer,JPMorganChase,Yeah. I always have to go put new batteries in my HP 12C when you ask me that question. All right. Yeah.,2025,Q2,False
qa,29,4,Gerard Cassidy,analyst,RBC Capital Markets LLC,"Jeremy, I'm glad you're still using HP 12C, that's good. Just as a follow-up...",2025,Q2,False
qa,29,5,Jamie Dimon,Chairman & Chief Executive Officer,JPMorganChase,"He just uses his big brain, he doesn't need the 12C.",2025,Q2,False
qa,29,5,Gerard Cassidy,analyst,RBC Capital Markets LLC,"Okay. As a quick follow-up for Jeremy, you touched on...",2025,Q2,True
qa,29,6,Jeremy Barnum,Chief Financial Officer,JPMorganChase,It's not true because if – can we not do that?,2025,Q2,False
qa,30,,Gerard Cassidy,analyst,RBC Capital Markets LLC,"Just as a quick follow-up Jeremy, in the Markets comment that you made, you said that there were fewer opportunities in Securitized Products and Fixed Income Financing. Can you expand upon that or give us any color there? Thank you.",2025,Q2,False
qa,30,1,Jeremy Barnum,Chief Financial Officer,JPMorganChase,"Yeah, sure. I mean, it's just normal diversification inside the Markets business. Those businesses are doing great. But like at the margin, in the second half of the quarter, stuff was a little quieter relative to emerging markets and the macro space, which was a little bit better.",2025,Q2,False
qa,30,1,Gerard Cassidy,analyst,RBC Capital Markets LLC,Thank you.,2025,Q2,True
qa,30,2,Jeremy Barnum,Chief Financial Officer,JPMorganChase,Nothing too dramatic.,2025,Q2,False
qa,30,2,Gerard Cassidy,analyst,RBC Capital Markets LLC,Thank you. Operator: Thank you. Our next question comes from Saul Martinez with HSBC. Your line is open.,2025,Q2,True
qa,31,,Saul Martinez,analyst,"HSBC Securities (USA), Inc.","Hey, good morning. Thanks for taking my question. Just one for me. I just want to follow-up on Ken's question about sales and trading. And I think you kind of addressed this, Jeremy, but I just – you’ve had another strong quarter there on the back of a pretty exceptional Q1 on the back of a really strong 2024. I mean, how are you thinking about how much of this really is the result of an exceptional trading environment versus something that's more durable and presumably less volatility, good for investment banking. But do you see – would you see some sort of normalization in sales and trading as a result? Or do you think there's still opportunities to grow certain businesses and take share? I'm just curious how much – how you think about what's exceptional versus what's more durable here.",2025,Q2,False
qa,31,1,Jeremy Barnum,Chief Financial Officer,JPMorganChase,"Yeah. I mean, one thing I'll say is that there's no weird exceptional thing happening in this particular quarter driving the results. So, it's pretty broad based, and it's not particularly lumpy. And as I said, I think it is true, and I think we've shared some of this in different ways, including in my slide at Investor Day, that we are deploying quite a bit of capital and other resources like G-SIB capacity and liquidity in some cases to generate that revenue. And we're happy with the returns, but it's not just like growing without any inputs, essentially. So, I guess, on the one hand you might say that that's a bit more durable for that reason, but it is important to realize that it's coming with that use of resources, essentially. So, I mean, we've gotten, over time, a little bit more relaxed about talking about the Markets business as something that has relatively uncorrelated and reasonably recurring revenues.",2025,Q2,False
qa,31,2,Jeremy Barnum,Chief Financial Officer,JPMorganChase,"It's obviously extremely client centric, there's a lot of financing of various types that's being supplied, and it seems to, if anything, more often than not be counter-cyclical rather than pro-cyclical. But it's still Markets, right? Things can happen, it's volatile, there's risk taking involved, that's part of the point that we build. Sorry to hedge the answer, but that's kind of how we think about it.",2025,Q2,False
qa,31,2,Saul Martinez,analyst,"HSBC Securities (USA), Inc.","That's fine. Thanks a lot, guys. Operator: Thank you. Our final question comes from Chris Kotowski with Oppenheimer. Your line is open.",2025,Q2,False
qa,32,,Chris Kotowski,analyst,"Oppenheimer & Co., Inc.","Yeah. Good morning and thanks. Kind of an old school bank analyst question. After a long time of kind of bemoaning slow C&I loan growth, you had this extraordinary growth this quarter, $33 billion in average and more than 6% quarter-over-quarter. But then, when we look at the P&L in the Commercial & Investment bank, net interest income is down 2% and lending income is down 4%. And I know there's hedges and other complicated things, but it just kind of doesn't compute that you'd have such strong loan growth and not have revenue growth associated with that.",2025,Q2,False
qa,32,1,Jeremy Barnum,Chief Financial Officer,JPMorganChase,"Yeah. I mean, the hedges are definitely part of it, and a lot of the assets came on the balance sheet quite late in the quarter, so I don't know, I might be missing something. There's probably some Markets it. There's Markets NII piece of it too. So, I don't know, Mikael can follow-up with you, but I think the loans thing is part of it, Markets NII is part of it, and late quarter…",2025,Q2,False
qa,32,2,Jamie Dimon,Chairman & Chief Executive Officer,JPMorganChase,Hedging,2025,Q2,False
qa,32,3,Jeremy Barnum,Chief Financial Officer,JPMorganChase,Hedges for sure. Yeah,2025,Q2,False
qa,32,3,Chris Kotowski,analyst,"Oppenheimer & Co., Inc.",Okay. All right. Thank you.,2025,Q2,True
qa,32,4,Jeremy Barnum,Chief Financial Officer,JPMorganChase,"Thanks. Operator: Thank you. We have no further questions. Thanks very much. Jamie Dimon Chairman & Chief Executive Officer, JPMorganChase And thank you. Operator: Operator: Thank you. We have no further questions. Disclaimer This document contains forward-looking statements within the meaning of the Private Securities Litigation Reform Act of 1995. These statements are based on the current beliefs and expectations of JPMorgan Chase & Co.’s management and are subject to significant risks and uncertainties. Actual results may differ from those set forth in the forward-looking statements. Factors that could cause JPMorgan Chase & Co.’s actual results to differ materially from those described in the forward-looking statements can be found in JPMorgan Chase & Co.’s Annual Report on Form 10-K for the year ended December 31, 2024, which has been filed with the Securities and Exchange Commission and is available on JPMorgan Chase & Co.’s website (https://jpmorganchaseco.gcs-web.com/financial-information/sec-filings), and on the Securities and Exchange Commission’s website (www.sec.gov). JPMorgan Chase & Co. does not undertake to update any forward-looking statements",2025,Q2,False
